Date Occured,Time Occured,City,State,Country,Shape,Summary,unique_id
10/14/2023,4:00,Austin,TX,USA,Unknown,"Perfectly silent craft drifts to the east, bright light seen, object came to a standstill several times",394
10/13/2023,19:03,Green Valley,AZ,USA,Orb,A very bright glowing white orb passed near our house and jetted into infinity without making a sound.,395
10/13/2023,19:00,"Sonoita, Arizona",AZ,USA,Light,"Bright light lasting for 5 to 6 total Mississippi seconds flew east to west through clouds, and disappeared, ridiculous speed no sound.",396
10/12/2023,23:40,Carrollton,TX,USA,Unknown,A blinding light shown down on my house even though there was no storm/ rain event. The light was blinding and illuminated my yard,397
10/12/2023,20:35,Waynesfield,OH,USA,Triangle,"Huge, triangular craft, bright strobing lights down each side",398
10/9/2023,3:30,Idaho Falls,ID,USA,Triangle,"Orange lights in the sky with smooth but random movement that joined in formation to form a triangle, then accelerated away from us.",399
10/8/2023,19:37,Powell Butte,OR,USA,Disk,Large disk,400
3/2/2024,22:23,Beckley,WV,USA,Orb,My captain and I saw moving stars. Looked kinda like satellites.,401
2/28/2024,22:00,Felton,CA,USA,Other,"Vaguely cube shaped, with multicolored lights and some motion.",402
2/28/2024,21:00,Mogi das Cruzes,São Paulo,Brazil,Orb,At least 40 orbs of light rising from the horizon in the distance,403
2/28/2024,19:06,Manitowoc,WI,USA,Triangle,Light flicker on house then looked up and seen triangle with 6 lights.,404
2/27/2024,21:00,,-,USA,Orb,Multiple orbs of light over the Pacific Ocean maneuvering in a purposeful way for over two hours,405
2/25/2024,21:12,Washington,DC,USA,Light,White light illuminated stationary before rapidly heading North and disappearing,406
2/24/2024,10:30,Great Hallingbury,England,United Kingdom,Cigar,UFO looked like a huge elongated wing seen edge on. It was hovering about 2 km from my location. It then abruptly vanished.,407
2/19/2024,21:15,Hilliard,FL,USA,Light,"While operating an aircraft in cruise at FL400, the crew observed 3 lights appearing and disappearing for approximately 1 hr 25 min.",408
2/18/2024,16:33,Mesa,AZ,USA,Triangle,One triangular shaped craft hovering over area doing aerobatics in daytime,409
2/17/2024,20:43,Rockford,IL,USA,Light,Triangle formation of lights with other lights making passes through and around the formation,410
2/16/2024,21:15,Pittsburgh,PA,USA,Light,8 Lights Moving in counter clockwise pattern with other lights making passes through and below the formation,411
2/10/2024,6:09,,Rio Grande do Sul,Brazil,Disk,Sighting of lights throughout the entire night with direct sighting of the ship in the shape of a flying saucer at dawn.,412
2/6/2024,13:33,Brandon,MS,USA,Teardrop,Silver UAP at approximately 5000ft the swims through the sky in an organic matter way with exhaust trail at faster than speed of sound,413
2/6/2024,3:30,Stockbridge,GA,USA,Cigar,"Approximately 330AM in a NNE sky, a cigar shaped object traveled around the Dubhe star in the Big Dipper.",414
2/5/2024,22:32,Hoquiam,WA,USA,Light,Light moving erratically,415
2/5/2024,4:55,Omaha,NE,USA,Light,"Flying to the East at 39,000 saw 6 UFO's at diff speeds, altitudes (btn 50, and 80 thousand feet) for ~ 1 hr",416
2/1/2024,22:00,Elleker,Western Australia,Australia,Other,"Banana shaped UFO yellow lights down side, with blue halo. Hovering moving slightly side to side. Halo flashed like surrounding orb.",417
2/1/2024,6:35,Auburn,AL,USA,Diamond,This came extremeley close to the left of our commercial plane left wing - I did notify Delta Airlines once we landed.,418
1/27/2024,3:00,Garden Valley,ID,USA,Disk,My wife saw a large object with white lights hovering over our property.,419
1/27/2024,3:00,Osprey,FL,USA,Disk,"Disc shaped objects still in the sky for about 2.5 hours with about 9 circular lights along the length, larger in the middle.",420
1/21/2024,22:30,Melrose,MA,USA,Diamond,"Ufo was about 200 ft from the ground, causing ground to shake and emitting a deafening humming noise while flashing lights into our car",421
1/17/2024,21:13,Pine City,MN,USA,Orb,Three large orange lights . When I caught them on video they were already 10 times smaller then they were when I first saw them.,422
1/16/2024,8:00,Lee,NH,USA,Sphere,Saw a ufo that then came into my yard + house,423
1/14/2024,21:10,Ithaca,NY,USA,Light,"Two lights climbing, descending, and changing direction rapidly",424
1/14/2024,5:00,Phoenix,AZ,USA,Formation,Maneuvering lights at very high altitude views for 45 minutes at FL400,425
1/13/2024,19:25,Charlotte,NC,USA,Triangle,An object with lights went back and forth,426
1/11/2024,4:30,,Erzincan,Türkiye,Sphere,Multiple lights flying and moving randomly.,427
1/10/2024,20:10,Yakima,WA,USA,Light,"Flying from DEN to PSC at 34,000’. Witnessed moving lights moving very fast and would appear and disappear. ATC had nothing on radar.",428
1/8/2024,1:00,Guelph,ON,Canada,Triangle,Possible TR3B black manta sighting.,429
1/7/2024,20:40,Roseburg,OR,USA,Light,2 lights looked to be spinning.,430
1/5/2024,21:10,Sault Ste. Marie,ON,Canada,Light,Erratically moving lights that would appear and disappear staying in the same approximate location in relation to the stars,431
1/2/2024,22:40,Oklahoma City,OK,USA,Oval,Seen the blue white oval object dart right to left from upstairs windows. When I fist witnessed It was stationary.,432
1/2/2024,18:45,Newtown,CT,USA,Light,"Elongated white light moving slowly or not at all, which then also displayed a series of colored lights in a line as I got closer.",433
12/26/2023,20:40,Bunnell,FL,USA,Changing,What appeared as bright star like points of light which would suddenly appear increasing in brightness and then fade away.,434
12/23/2023,3:30,,,International Waters,Light,"Objects at very high altitude (greater than 50,000' MSL) maneuvering and emitting white light that gradually varied from bright to dim",435
12/20/2023,3:00,Horace,KS,USA,Unknown,4 white lights of changing intensity resembling stars moving in a portion of the night sky.,436
12/16/2023,22:45,Little Rock,AR,USA,Light,5 Lights Moving Rapidly and Changing Direction,437
12/16/2023,20:50,Ferndale,MI,USA,Sphere,A simple sighting which lasted one second.,438
12/14/2023,19:45,Pawleys Island,SC,USA,Triangle,4-5 orange solid lights arranged in a triangle shape,439
12/13/2023,23:00,Greensboro,NC,USA,Orb,"AM sighting of a bright intense light that was hovering over tree line and a PM sighting with 2 crafts of the same ""look"".",440
12/8/2023,21:00,Lowell,MI,USA,Disk,Greyish disc with two bright white lights one on each side on front circumference and multi colored red green lights,441
12/4/2023,1:00,Lorain,OH,USA,Sphere,"A Semi Transparent, White Colored, Luminescent Spherical Cloud circled directly above my home before disappearing entirely.",442
12/3/2023,23:59,Memphis,IN,USA,Light,Unexplained bright shiny light,443
11/30/2023,20:25,Denton,NE,USA,Unknown,I observed an aircraft with two bright lights to be stagnant and hovering over my pasture approximately 100' in the air.,444
11/30/2023,3:10,Franksville,WI,USA,Orb,4 Objects Moving and Dimming On and Off,445
11/28/2023,19:14,Ridge,MD,USA,Other,Object hovered approx 1/2 mile above Potomac River,446
11/28/2023,0:30,,Yucatan,Mexico,Diamond,Went to room to sit on balcony and spotted bright light moving very fast,447
11/26/2023,21:15,Thedford,NE,USA,Circle,3 lighted objects circling at high altitude that were both bright and dim,448
11/25/2023,13:22,Brinnon,WA,USA,Disk,"Taking picture of dog, raising camera to zoom object low high speed pass pushed shutter repeatedly got one image and was gone. Silent",449
11/24/2023,20:15,Dothan,AL,USA,Rectangle,"Blue rectangle appears above the trees, about 30' high, above us, and then shoots off to the West.",450
11/21/2023,20:30,Stillwater,OK,USA,Light,As many as 4 lights were simultaneously observed corroborated with no less than 6-7 other aircraft on Denver Center,451
11/21/2023,19:00,Oklahoma City,OK,USA,Light,Points of light maneuvering in upper atmosphere,452
11/20/2023,17:15,Halfway,MD,USA,Light,At 1st glance lights (4) appeared slightly higher than street lamps but change into just 2 larger bright lights that tilted & vanished,453
11/18/2023,12:15,Oro Valley,AZ,USA,Sphere,Metallic UAP or Balloon,454
11/17/2023,12:58,Lincolnshire,IL,USA,Other,"Craft was total stationary and totally silent,just above a tree.",455
11/16/2023,12:45,Boyce,VA,USA,Disk,Object was above arboretum. Moving rapidly sideways and up and down then hovering,456
11/15/2023,21:00,Lincolnshire,IL,USA,Rectangle,"Platform type craft traveling low over forest with lights illuminating the top but no lights on bottom, at night.",457
11/14/2023,23:00,Chicago,IL,USA,Cigar,"I saw a cigar shaped saucer with four lights on the underbelly of the craft, and a blue haze was being emitted from the underbelly.",458
11/13/2023,20:20,Cheyenne,WY,USA,Light,Saw a light go from dim to very bright,459
11/13/2023,15:34,Milan,IN,USA,Triangle,Triangle black craft,460
11/12/2023,18:55,Nixon,PA,USA,Disk,Driving at night and saw a green lit object drop down and zoom off,461
11/11/2023,22:40,Slippery Rock,PA,USA,Triangle,Triangle shaped craft that moved like nothing I’ve ever seen.,462
11/11/2023,21:30,Lakeland,FL,USA,Triangle,I saw a HUGE triangle craft with at least 7 bright white lights in a perfect “V” at the front and no lights on the backend of it,463
11/11/2023,20:04,Midvale,UT,USA,Light,Unidentified lights flying above.,464
11/11/2023,18:30,Windham,ME,USA,Rectangle,Floating rectangle with 3 lights,465
11/10/2023,6:13,Denver,CO,USA,Orb,"Basketball sized ball of light, about the same brightness as a flood light flying low and slow.",466
11/9/2023,20:15,,KY,USA,Light,"Lighted objects ""dancing"" and performing seemingly impossible aeronautic maneuvers",467
11/9/2023,9:45,Topeka,KS,USA,Disk,There was a black but yet reflective basic saucer shaped UAP.,468
11/9/2023,6:45,Elkin,NC,USA,Disk,A silver metallic disc rising vertically from the ground.,469
11/8/2023,20:08,Wimberley,TX,USA,Orb,Large helicopter chasing an amber glowing orb,470
11/8/2023,4:28,Hartford,CT,USA,Orb,Craft swooped down fast & floated with bright white rotating lights & 2 beams of light darting around & on & off,471
11/6/2023,22:30,Blairsville,GA,USA,Triangle,Triangle craft with green lights gliding through sky,472
11/5/2023,20:28,Hamilton,NJ,USA,Orb,"Object was briefly stationary, before traveling in an apparent fish hook shape. Then vanished.",473
11/5/2023,19:52,Santa Fe,FL,USA,Formation,"While driving (dark) noticed 2 large lights to left. Once at field, saw underside, 3 lights(triangle) and small ones. Drove away.",474
11/5/2023,10:32,Mount Morris,PA,USA,Orb,"Large extremely fast moving orb moving across the sky that stopped in midair, turned, and continued in the direction",475
11/2/2023,22:25,Sioux Falls,SD,USA,Chevron,Low flying silent craft with stealth coating.,476
10/31/2023,19:00,Casa Grande,AZ,USA,Light,Rectangular light fixed in the Northwestern sky for over 3 hours.,477
10/30/2023,19:52,Garden City,KS,USA,Light,A light moving southwest to the east then changing to a southeast heading,478
10/29/2023,11:45,Bayport,NY,USA,Orb,"Son playing outside , witnessed object",479
10/29/2023,5:30,Cowes,England,United Kingdom,Triangle,"Large, quiet, triangular craft flew over 2 witnesses at 05:30 on Sunday morning, off the central southern coast of England",480
10/27/2023,18:46,San Diego,CA,USA,Orb,Falling Fire Ball Disseminates into Five Hovering Orbs of Light,481
10/24/2023,21:30,Deshler,OH,USA,Light,Bright rectangular light on the ground,482
10/24/2023,9:33,Government Hill,AZ,USA,Triangle,Enormous white triangle craft with point straight down.,483
10/23/2023,3:30,Airborne (Oman),,Oman,Light,Observed steady lights at high altitude at a specific location in the sky.,484
10/22/2023,3:30,Avondale,TX,USA,Triangle,Slow flying and rotating huge Triangle,485
10/21/2023,9:00,Klamath Falls,OR,USA,Cylinder,Heard loud crash and then saw object fly by.,486
10/19/2023,22:20,Two Harbors,MN,USA,Changing,Shape shifting dark black triangle moved across the sky,487
10/19/2023,19:00,Alexandria,VA,USA,Unknown,Orange fiery objects flying low in a procession,488
10/19/2023,3:00,Las Vegas (in flight),NV,USA,Star,"While operating an airline flight at 37,000’ both pilots witnessed three lights at very high altitude moving in random patterns.",489
10/18/2023,19:33,Forestville,MD,USA,Fireball,white roundish size object captured on doorbell cam,490
10/17/2023,19:39,Not sure,MN,USA,Formation,"Three series of 3 slightly yellow/ white,lights spaced wide apart that then became one bright light, then went back to three..",491
10/17/2023,2:00,Middle of the Caspian Sea directly east of Baku,,Unspecified,Light,Two commercial airline pilots saw a light 150km away that was still then suddenly accelerated at incredible speed and disappeared,492
10/16/2023,8:58,,AR,USA,Cylinder,Lower altitude flyby of Allegiant Flight 3145 on a 180 flight trajectory.,493
10/14/2023,4:00,Austin,TX,USA,Unknown,"Perfectly silent craft drifts to the east, bright light seen, object came to a standstill several times",494
10/13/2023,19:03,Green Valley,AZ,USA,Orb,A very bright glowing white orb passed near our house and jetted into infinity without making a sound.,495
10/13/2023,19:00,"Sonoita, Arizona",AZ,USA,Light,"Bright light lasting for 5 to 6 total Mississippi seconds flew east to west through clouds, and disappeared, ridiculous speed no sound.",496
10/12/2023,23:40,Carrollton,TX,USA,Unknown,A blinding light shown down on my house even though there was no storm/ rain event. The light was blinding and illuminated my yard,497
10/12/2023,20:35,Waynesfield,OH,USA,Triangle,"Huge, triangular craft, bright strobing lights down each side",498
10/9/2023,3:30,Idaho Falls,ID,USA,Triangle,"Orange lights in the sky with smooth but random movement that joined in formation to form a triangle, then accelerated away from us.",499
10/8/2023,19:37,Powell Butte,OR,USA,Disk,Large disk,500
3/2/2024,22:23,Beckley,WV,USA,Orb,My captain and I saw moving stars. Looked kinda like satellites.,501
2/28/2024,22:00,Felton,CA,USA,Other,"Vaguely cube shaped, with multicolored lights and some motion.",502
2/28/2024,21:00,Mogi das Cruzes,São Paulo,Brazil,Orb,At least 40 orbs of light rising from the horizon in the distance,503
2/28/2024,19:06,Manitowoc,WI,USA,Triangle,Light flicker on house then looked up and seen triangle with 6 lights.,504
2/27/2024,21:00,,-,USA,Orb,Multiple orbs of light over the Pacific Ocean maneuvering in a purposeful way for over two hours,505
2/25/2024,21:12,Washington,DC,USA,Light,White light illuminated stationary before rapidly heading North and disappearing,506
2/24/2024,10:30,Great Hallingbury,England,United Kingdom,Cigar,UFO looked like a huge elongated wing seen edge on. It was hovering about 2 km from my location. It then abruptly vanished.,507
2/19/2024,21:15,Hilliard,FL,USA,Light,"While operating an aircraft in cruise at FL400, the crew observed 3 lights appearing and disappearing for approximately 1 hr 25 min.",508
2/18/2024,16:33,Mesa,AZ,USA,Triangle,One triangular shaped craft hovering over area doing aerobatics in daytime,509
2/17/2024,20:43,Rockford,IL,USA,Light,Triangle formation of lights with other lights making passes through and around the formation,510
2/16/2024,21:15,Pittsburgh,PA,USA,Light,8 Lights Moving in counter clockwise pattern with other lights making passes through and below the formation,511
2/10/2024,6:09,,Rio Grande do Sul,Brazil,Disk,Sighting of lights throughout the entire night with direct sighting of the ship in the shape of a flying saucer at dawn.,512
2/6/2024,13:33,Brandon,MS,USA,Teardrop,Silver UAP at approximately 5000ft the swims through the sky in an organic matter way with exhaust trail at faster than speed of sound,513
2/6/2024,3:30,Stockbridge,GA,USA,Cigar,"Approximately 330AM in a NNE sky, a cigar shaped object traveled around the Dubhe star in the Big Dipper.",514
2/5/2024,22:32,Hoquiam,WA,USA,Light,Light moving erratically,515
2/5/2024,4:55,Omaha,NE,USA,Light,"Flying to the East at 39,000 saw 6 UFO's at diff speeds, altitudes (btn 50, and 80 thousand feet) for ~ 1 hr",516
2/1/2024,22:00,Elleker,Western Australia,Australia,Other,"Banana shaped UFO yellow lights down side, with blue halo. Hovering moving slightly side to side. Halo flashed like surrounding orb.",517
2/1/2024,6:35,Auburn,AL,USA,Diamond,This came extremeley close to the left of our commercial plane left wing - I did notify Delta Airlines once we landed.,518
1/27/2024,3:00,Garden Valley,ID,USA,Disk,My wife saw a large object with white lights hovering over our property.,519
1/27/2024,3:00,Osprey,FL,USA,Disk,"Disc shaped objects still in the sky for about 2.5 hours with about 9 circular lights along the length, larger in the middle.",520
1/21/2024,22:30,Melrose,MA,USA,Diamond,"Ufo was about 200 ft from the ground, causing ground to shake and emitting a deafening humming noise while flashing lights into our car",521
1/17/2024,21:13,Pine City,MN,USA,Orb,Three large orange lights . When I caught them on video they were already 10 times smaller then they were when I first saw them.,522
1/16/2024,8:00,Lee,NH,USA,Sphere,Saw a ufo that then came into my yard + house,523
1/14/2024,21:10,Ithaca,NY,USA,Light,"Two lights climbing, descending, and changing direction rapidly",524
1/14/2024,5:00,Phoenix,AZ,USA,Formation,Maneuvering lights at very high altitude views for 45 minutes at FL400,525
1/13/2024,19:25,Charlotte,NC,USA,Triangle,An object with lights went back and forth,526
1/11/2024,4:30,,Erzincan,Türkiye,Sphere,Multiple lights flying and moving randomly.,527
1/10/2024,20:10,Yakima,WA,USA,Light,"Flying from DEN to PSC at 34,000’. Witnessed moving lights moving very fast and would appear and disappear. ATC had nothing on radar.",528
1/8/2024,1:00,Guelph,ON,Canada,Triangle,Possible TR3B black manta sighting.,529
1/7/2024,20:40,Roseburg,OR,USA,Light,2 lights looked to be spinning.,530
1/5/2024,21:10,Sault Ste. Marie,ON,Canada,Light,Erratically moving lights that would appear and disappear staying in the same approximate location in relation to the stars,531
1/2/2024,22:40,Oklahoma City,OK,USA,Oval,Seen the blue white oval object dart right to left from upstairs windows. When I fist witnessed It was stationary.,532
1/2/2024,18:45,Newtown,CT,USA,Light,"Elongated white light moving slowly or not at all, which then also displayed a series of colored lights in a line as I got closer.",533
12/26/2023,20:40,Bunnell,FL,USA,Changing,What appeared as bright star like points of light which would suddenly appear increasing in brightness and then fade away.,534
12/23/2023,3:30,,,International Waters,Light,"Objects at very high altitude (greater than 50,000' MSL) maneuvering and emitting white light that gradually varied from bright to dim",535
12/20/2023,3:00,Horace,KS,USA,Unknown,4 white lights of changing intensity resembling stars moving in a portion of the night sky.,536
12/16/2023,22:45,Little Rock,AR,USA,Light,5 Lights Moving Rapidly and Changing Direction,537
12/16/2023,20:50,Ferndale,MI,USA,Sphere,A simple sighting which lasted one second.,538
12/14/2023,19:45,Pawleys Island,SC,USA,Triangle,4-5 orange solid lights arranged in a triangle shape,539
12/13/2023,23:00,Greensboro,NC,USA,Orb,"AM sighting of a bright intense light that was hovering over tree line and a PM sighting with 2 crafts of the same ""look"".",540
12/8/2023,21:00,Lowell,MI,USA,Disk,Greyish disc with two bright white lights one on each side on front circumference and multi colored red green lights,541
12/4/2023,1:00,Lorain,OH,USA,Sphere,"A Semi Transparent, White Colored, Luminescent Spherical Cloud circled directly above my home before disappearing entirely.",542
12/3/2023,23:59,Memphis,IN,USA,Light,Unexplained bright shiny light,543
11/30/2023,20:25,Denton,NE,USA,Unknown,I observed an aircraft with two bright lights to be stagnant and hovering over my pasture approximately 100' in the air.,544
11/30/2023,3:10,Franksville,WI,USA,Orb,4 Objects Moving and Dimming On and Off,545
11/28/2023,19:14,Ridge,MD,USA,Other,Object hovered approx 1/2 mile above Potomac River,546
11/28/2023,0:30,,Yucatan,Mexico,Diamond,Went to room to sit on balcony and spotted bright light moving very fast,547
11/26/2023,21:15,Thedford,NE,USA,Circle,3 lighted objects circling at high altitude that were both bright and dim,548
11/25/2023,13:22,Brinnon,WA,USA,Disk,"Taking picture of dog, raising camera to zoom object low high speed pass pushed shutter repeatedly got one image and was gone. Silent",549
11/24/2023,20:15,Dothan,AL,USA,Rectangle,"Blue rectangle appears above the trees, about 30' high, above us, and then shoots off to the West.",550
11/21/2023,20:30,Stillwater,OK,USA,Light,As many as 4 lights were simultaneously observed corroborated with no less than 6-7 other aircraft on Denver Center,551
11/21/2023,19:00,Oklahoma City,OK,USA,Light,Points of light maneuvering in upper atmosphere,552
11/20/2023,17:15,Halfway,MD,USA,Light,At 1st glance lights (4) appeared slightly higher than street lamps but change into just 2 larger bright lights that tilted & vanished,553
11/18/2023,12:15,Oro Valley,AZ,USA,Sphere,Metallic UAP or Balloon,554
11/17/2023,12:58,Lincolnshire,IL,USA,Other,"Craft was total stationary and totally silent,just above a tree.",555
11/16/2023,12:45,Boyce,VA,USA,Disk,Object was above arboretum. Moving rapidly sideways and up and down then hovering,556
11/15/2023,21:00,Lincolnshire,IL,USA,Rectangle,"Platform type craft traveling low over forest with lights illuminating the top but no lights on bottom, at night.",557
11/14/2023,23:00,Chicago,IL,USA,Cigar,"I saw a cigar shaped saucer with four lights on the underbelly of the craft, and a blue haze was being emitted from the underbelly.",558
11/13/2023,20:20,Cheyenne,WY,USA,Light,Saw a light go from dim to very bright,559
11/13/2023,15:34,Milan,IN,USA,Triangle,Triangle black craft,560
11/12/2023,18:55,Nixon,PA,USA,Disk,Driving at night and saw a green lit object drop down and zoom off,561
11/11/2023,22:40,Slippery Rock,PA,USA,Triangle,Triangle shaped craft that moved like nothing I’ve ever seen.,562
11/11/2023,21:30,Lakeland,FL,USA,Triangle,I saw a HUGE triangle craft with at least 7 bright white lights in a perfect “V” at the front and no lights on the backend of it,563
11/11/2023,20:04,Midvale,UT,USA,Light,Unidentified lights flying above.,564
11/11/2023,18:30,Windham,ME,USA,Rectangle,Floating rectangle with 3 lights,565
11/10/2023,6:13,Denver,CO,USA,Orb,"Basketball sized ball of light, about the same brightness as a flood light flying low and slow.",566
11/9/2023,20:15,,KY,USA,Light,"Lighted objects ""dancing"" and performing seemingly impossible aeronautic maneuvers",567
11/9/2023,9:45,Topeka,KS,USA,Disk,There was a black but yet reflective basic saucer shaped UAP.,568
11/9/2023,6:45,Elkin,NC,USA,Disk,A silver metallic disc rising vertically from the ground.,569
11/8/2023,20:08,Wimberley,TX,USA,Orb,Large helicopter chasing an amber glowing orb,570
11/8/2023,4:28,Hartford,CT,USA,Orb,Craft swooped down fast & floated with bright white rotating lights & 2 beams of light darting around & on & off,571
11/6/2023,22:30,Blairsville,GA,USA,Triangle,Triangle craft with green lights gliding through sky,572
11/5/2023,20:28,Hamilton,NJ,USA,Orb,"Object was briefly stationary, before traveling in an apparent fish hook shape. Then vanished.",573
11/5/2023,19:52,Santa Fe,FL,USA,Formation,"While driving (dark) noticed 2 large lights to left. Once at field, saw underside, 3 lights(triangle) and small ones. Drove away.",574
11/5/2023,10:32,Mount Morris,PA,USA,Orb,"Large extremely fast moving orb moving across the sky that stopped in midair, turned, and continued in the direction",575
11/2/2023,22:25,Sioux Falls,SD,USA,Chevron,Low flying silent craft with stealth coating.,576
10/31/2023,19:00,Casa Grande,AZ,USA,Light,Rectangular light fixed in the Northwestern sky for over 3 hours.,577
10/30/2023,19:52,Garden City,KS,USA,Light,A light moving southwest to the east then changing to a southeast heading,578
10/29/2023,11:45,Bayport,NY,USA,Orb,"Son playing outside , witnessed object",579
10/29/2023,5:30,Cowes,England,United Kingdom,Triangle,"Large, quiet, triangular craft flew over 2 witnesses at 05:30 on Sunday morning, off the central southern coast of England",580
10/27/2023,18:46,San Diego,CA,USA,Orb,Falling Fire Ball Disseminates into Five Hovering Orbs of Light,581
10/24/2023,21:30,Deshler,OH,USA,Light,Bright rectangular light on the ground,582
10/24/2023,9:33,Government Hill,AZ,USA,Triangle,Enormous white triangle craft with point straight down.,583
10/23/2023,3:30,Airborne (Oman),,Oman,Light,Observed steady lights at high altitude at a specific location in the sky.,584
10/22/2023,3:30,Avondale,TX,USA,Triangle,Slow flying and rotating huge Triangle,585
10/21/2023,9:00,Klamath Falls,OR,USA,Cylinder,Heard loud crash and then saw object fly by.,586
10/19/2023,22:20,Two Harbors,MN,USA,Changing,Shape shifting dark black triangle moved across the sky,587
10/19/2023,19:00,Alexandria,VA,USA,Unknown,Orange fiery objects flying low in a procession,588
10/19/2023,3:00,Las Vegas (in flight),NV,USA,Star,"While operating an airline flight at 37,000’ both pilots witnessed three lights at very high altitude moving in random patterns.",589
10/18/2023,19:33,Forestville,MD,USA,Fireball,white roundish size object captured on doorbell cam,590
10/17/2023,19:39,Not sure,MN,USA,Formation,"Three series of 3 slightly yellow/ white,lights spaced wide apart that then became one bright light, then went back to three..",591
